{
  "$schema": "../schemas/protocol-catalog.schema.json",
  "schema": "hyperflux-protocol-catalog-v1",
  "minimum_version": 1,
  "maximum_version": 1,
  "features": ["ownership-leases", "atomic-transactions", "event-subscriptions", "structured-diagnostics"],
  "records": [
    {
      "name": "EmptyRequest",
      "description": "A method request with no method-specific fields.",
      "fields": []
    },
    {
      "name": "RgbColor",
      "description": "One canonical eight-bit RGB color.",
      "fields": [
        {"name": "red", "type": "ColorChannel", "required": true, "many": false, "max_items": null, "description": "Red channel."},
        {"name": "green", "type": "ColorChannel", "required": true, "many": false, "max_items": null, "description": "Green channel."},
        {"name": "blue", "type": "ColorChannel", "required": true, "many": false, "max_items": null, "description": "Blue channel."}
      ]
    },
    {
      "name": "ClientHello",
      "description": "Bounded client protocol and feature offer.",
      "fields": [
        {"name": "client_id", "type": "ClientId", "required": true, "many": false, "max_items": null, "description": "Process-scoped client identity."},
        {"name": "client_name", "type": "ClientName", "required": true, "many": false, "max_items": null, "description": "User-facing application name."},
        {"name": "minimum_version", "type": "ProtocolVersion", "required": true, "many": false, "max_items": null, "description": "Oldest protocol accepted by the client."},
        {"name": "maximum_version", "type": "ProtocolVersion", "required": true, "many": false, "max_items": null, "description": "Newest protocol accepted by the client."},
        {"name": "requested_features", "type": "CapabilityId", "required": true, "many": true, "max_items": 64, "description": "Optional SDK features requested by the client."}
      ]
    },
    {
      "name": "ServerHello",
      "description": "Negotiated protocol version and bridge feature set.",
      "fields": [
        {"name": "selected_version", "type": "ProtocolVersion", "required": true, "many": false, "max_items": null, "description": "Mutually supported protocol version."},
        {"name": "bridge_version", "type": "ComponentVersion", "required": true, "many": false, "max_items": null, "description": "Bridge component version."},
        {"name": "enabled_features", "type": "CapabilityId", "required": true, "many": true, "max_items": 64, "description": "Features enabled for this connection."},
        {"name": "event_buffer_capacity", "type": "QueueCapacity", "required": true, "many": false, "max_items": null, "description": "Maximum retained event count."}
      ]
    },
    {
      "name": "ResourceKey",
      "description": "One device-scoped writable resource.",
      "fields": [
        {"name": "device_id", "type": "LogicalDeviceId", "required": true, "many": false, "max_items": null, "description": "Logical resource owner."},
        {"name": "kind", "type": "ResourceKind", "required": true, "many": false, "max_items": null, "description": "Generic resource domain."}
      ]
    },
    {
      "name": "LeaseRequest",
      "description": "Atomic request for one or more writable resources.",
      "fields": [
        {"name": "request_id", "type": "RequestId", "required": true, "many": false, "max_items": null, "description": "Idempotency identity."},
        {"name": "client_id", "type": "ClientId", "required": true, "many": false, "max_items": null, "description": "Requesting client."},
        {"name": "resources", "type": "ResourceKey", "required": true, "many": true, "max_items": 32, "description": "Complete atomic resource set."},
        {"name": "duration_ms", "type": "LeaseDurationMs", "required": true, "many": false, "max_items": null, "description": "Renewable lease duration."}
      ]
    },
    {
      "name": "LeaseGrant",
      "description": "Granted ownership lease.",
      "fields": [
        {"name": "lease_id", "type": "LeaseId", "required": true, "many": false, "max_items": null, "description": "Lease identity."},
        {"name": "client_id", "type": "ClientId", "required": true, "many": false, "max_items": null, "description": "Owning client."},
        {"name": "resources", "type": "ResourceKey", "required": true, "many": true, "max_items": 32, "description": "Atomically owned resources."},
        {"name": "expires_at_ms", "type": "MonotonicMs", "required": true, "many": false, "max_items": null, "description": "Exclusive monotonic expiry."},
        {"name": "state", "type": "LeaseState", "required": true, "many": false, "max_items": null, "description": "Current lease state."}
      ]
    },
    {
      "name": "LeaseResult",
      "description": "Atomic lease decision with bounded conflict detail.",
      "fields": [
        {"name": "outcome", "type": "LeaseOutcome", "required": true, "many": false, "max_items": null, "description": "Lease decision."},
        {"name": "grant", "type": "LeaseGrant", "required": false, "many": false, "max_items": null, "description": "Grant when ownership succeeds."},
        {"name": "conflicting_client", "type": "ClientId", "required": false, "many": false, "max_items": null, "description": "Current owner when known."},
        {"name": "conflicting_resource", "type": "ResourceKey", "required": false, "many": false, "max_items": null, "description": "First deterministic conflict."}
      ]
    },
    {
      "name": "LeaseAction",
      "description": "Renewal or release of one existing lease.",
      "fields": [
        {"name": "request_id", "type": "RequestId", "required": true, "many": false, "max_items": null, "description": "Idempotency identity."},
        {"name": "client_id", "type": "ClientId", "required": true, "many": false, "max_items": null, "description": "Owning client."},
        {"name": "lease_id", "type": "LeaseId", "required": true, "many": false, "max_items": null, "description": "Lease to change."},
        {"name": "duration_ms", "type": "LeaseDurationMs", "required": false, "many": false, "max_items": null, "description": "New duration for renewal."}
      ]
    },
    {
      "name": "LogicalDeviceSnapshot",
      "description": "Application-neutral logical controller state.",
      "fields": [
        {"name": "device_id", "type": "LogicalDeviceId", "required": true, "many": false, "max_items": null, "description": "Logical identity."},
        {"name": "device_kind", "type": "DeviceKind", "required": true, "many": false, "max_items": null, "description": "Device category."},
        {"name": "product_id", "type": "ProductId", "required": true, "many": false, "max_items": null, "description": "Observed product id."},
        {"name": "profile_id", "type": "ProfileId", "required": false, "many": false, "max_items": null, "description": "Qualified profile when available."},
        {"name": "presence", "type": "PresenceState", "required": true, "many": false, "max_items": null, "description": "Derived controller presence."},
        {"name": "connection_mode", "type": "ConnectionMode", "required": true, "many": false, "max_items": null, "description": "Current route mode."},
        {"name": "support_level", "type": "SupportLevel", "required": true, "many": false, "max_items": null, "description": "Evidence-backed support level."},
        {"name": "battery_percent", "type": "BatteryPercent", "required": false, "many": false, "max_items": null, "description": "Latest valid battery value."},
        {"name": "capabilities", "type": "CapabilityId", "required": true, "many": true, "max_items": 128, "description": "Qualified semantic capabilities."}
      ]
    },
    {
      "name": "ReceiverSnapshot",
      "description": "Generation-bound receiver and child inventory.",
      "fields": [
        {"name": "receiver_id", "type": "ReceiverId", "required": true, "many": false, "max_items": null, "description": "Logical receiver identity."},
        {"name": "generation_id", "type": "GenerationId", "required": true, "many": false, "max_items": null, "description": "Current receiver generation."},
        {"name": "lifecycle", "type": "ReceiverLifecycleState", "required": true, "many": false, "max_items": null, "description": "Receiver lifecycle state."},
        {"name": "devices", "type": "LogicalDeviceSnapshot", "required": true, "many": true, "max_items": 32, "description": "Independent logical children."},
        {"name": "stable_restore_enabled", "type": "Boolean", "required": true, "many": false, "max_items": null, "description": "Whether stable state restoration is enabled."}
      ]
    },
    {
      "name": "BridgeSnapshot",
      "description": "Sequence-bound complete bridge snapshot.",
      "fields": [
        {"name": "sequence", "type": "SequenceNumber", "required": true, "many": false, "max_items": null, "description": "Latest event sequence reflected by this snapshot."},
        {"name": "receivers", "type": "ReceiverSnapshot", "required": true, "many": true, "max_items": 16, "description": "Registered receiver generations."}
      ]
    },
    {
      "name": "LightingFrame",
      "description": "One logical-device direct-mode frame.",
      "fields": [
        {"name": "device_id", "type": "LogicalDeviceId", "required": true, "many": false, "max_items": null, "description": "Frame target."},
        {"name": "frame_index", "type": "FrameIndex", "required": true, "many": false, "max_items": null, "description": "Transaction-local frame order."},
        {"name": "colors", "type": "RgbColor", "required": true, "many": true, "max_items": 4096, "description": "Logical LED colors before carrier translation."}
      ]
    },
    {
      "name": "TransactionRequest",
      "description": "Atomic generation- and ownership-bound operation.",
      "fields": [
        {"name": "request_id", "type": "RequestId", "required": true, "many": false, "max_items": null, "description": "Idempotency identity."},